id,conversation_id,created_at,date,time,timezone,user_id,username,name,place,tweet,language,mentions,urls,photos,replies_count,retweets_count,likes_count,hashtags,cashtags,link,retweet,quote_url,video,thumbnail,near,geo,source,user_rt_id,user_rt,retweet_id,reply_to,retweet_date,translate,trans_src,trans_dest
1373360585249726465,1373360585249726465,2021-03-20 14:47:33 Central Daylight Time,2021-03-20,14:47:33,-0500,715990372556660736,rapallstars,Rap All-Stars 🏆,,NBA YoungBoy showing love to a fan at GameStop.  https://t.co/CDSmQaFhcB,en,[],[],"['https://pbs.twimg.com/media/Ew8oLDkWQAAJvrq.jpg', 'https://pbs.twimg.com/media/Ew8oLDjW8AANV0j.jpg']",58,526,7054,[],[],https://twitter.com/RapAllStars/status/1373360585249726465,False,,1,https://pbs.twimg.com/media/Ew8oLDkWQAAJvrq.jpg,,,,,,,[],,,,
1372432089895813120,1372432089895813120,2021-03-18 01:18:03 Central Daylight Time,2021-03-18,01:18:03,-0500,2439848450,matttgfx,Mattthew Graphics 🦆,,stimulus: $1400  nintendo fans at gamestop: one pro controller and a single joycon please,en,[],[],[],96,2969,32272,[],[],https://twitter.com/MatttGFX/status/1372432089895813120,False,,0,,,,,,,,[],,,,
1370906368274731008,1370906368274731008,2021-03-13 19:15:23 Central Standard Time,2021-03-13,19:15:23,-0500,26624619,casualhoya,Casual Hoya,,GEORGETOWN IS THE GAMESTOP OF COLLEGE BASKETBALL.,en,[],[],[],33,392,1949,[],[],https://twitter.com/CasualHoya/status/1370906368274731008,False,,0,,,,,,,,[],,,,
1370419906844504064,1370419906844504064,2021-03-12 11:02:21 Central Standard Time,2021-03-12,11:02:21,-0500,868578294916145152,wsbchairman,The Chairman,,Forget the dollar. GameStop in-store credits are the currency of the future.,en,[],[],[],133,183,3172,[],[],https://twitter.com/WSBChairman/status/1370419906844504064,False,,0,,,,,,,,[],,,,
1370208698707103747,1370208698707103747,2021-03-11 21:03:05 Central Standard Time,2021-03-11,21:03:05,-0500,1378000488,originalfunko,Funko,,RT &amp; follow @OriginalFunko for the chance to WIN this @GameStop exclusive Venomized Gwenpool Pop!  https://t.co/04bpBFAzxn #Funko #FunkoPop #Marvel #Gwenpool  https://t.co/YU5QZszOjn,en,"[{'screen_name': 'originalfunko', 'name': 'funko', 'id': '1378000488'}, {'screen_name': 'gamestop', 'name': 'gamestop', 'id': '22258315'}]",['https://bit.ly/3qFJSUw'],"['https://pbs.twimg.com/media/EwP1i5YWgAQUaKe.jpg', 'https://pbs.twimg.com/media/EwP1jLFXEAMsJy4.jpg']",158,8335,4611,"['funko', 'funkopop', 'marvel', 'gwenpool']",[],https://twitter.com/OriginalFunko/status/1370208698707103747,False,,1,https://pbs.twimg.com/media/EwP1i5YWgAQUaKe.jpg,,,,,,,[],,,,
1370018170627575808,1370018170627575808,2021-03-11 08:26:00 Central Standard Time,2021-03-11,08:26:00,-0500,1282418324228337665,wsbmod,wallstreetbets,,"I just got off the phone with Gamestop customer service.  They said ""Please hold.""",en,[],[],[],365,2529,29059,[],[],https://twitter.com/wsbmod/status/1370018170627575808,False,,0,,,,,,,,[],,,,
1369708947175792646,1369708947175792646,2021-03-10 11:57:15 Central Standard Time,2021-03-10,11:57:15,-0500,858716964,pftcommenter,PFTCommenter,,Livelook at my hands after I forgot to sell gamestop like a month ago  https://t.co/reyoXuC3Od,en,[],[],['https://pbs.twimg.com/media/EwIvBwEXMAcvHqw.jpg'],35,229,8711,[],[],https://twitter.com/PFTCommenter/status/1369708947175792646,False,,1,https://pbs.twimg.com/media/EwIvBwEXMAcvHqw.jpg,,,,,,,[],,,,
1369704381810151425,1369704381810151425,2021-03-10 11:39:07 Central Standard Time,2021-03-10,11:39:07,-0500,93529573,michaelbatnick,Michael Batnick,,"GameStop just fell 40% in 15 minutes.   If you don't think this could happen to the S&amp;P 500, you're right.",en,[],[],[],103,205,3815,[],[],https://twitter.com/michaelbatnick/status/1369704381810151425,False,,0,,,,,,,,[],,,,
1369691363235655681,1369691363235655681,2021-03-10 10:47:23 Central Standard Time,2021-03-10,10:47:23,-0500,499968144,shivamchatak,S,,Everything with GameStop is making me realize how I should have invested more time in our relationship. I treated it like a Game and I wish it never Stopped.  https://t.co/l8sACEzewJ,en,[],[],['https://pbs.twimg.com/media/EwIe8ifU8AA91Dd.jpg'],40,692,3711,[],[],https://twitter.com/ShivamChatak/status/1369691363235655681,False,,1,https://pbs.twimg.com/media/EwIe8ifU8AA91Dd.jpg,,,,,,,[],,,,
1369688338253422592,1369688338253422592,2021-03-10 10:35:22 Central Standard Time,2021-03-10,10:35:22,-0500,54439269,bawbdylan,shark boy,,me with my one measly gamestop share  https://t.co/Q48GVWSjMn,en,[],[],['https://pbs.twimg.com/media/EwIcSNGWYAAfyI-.jpg'],59,195,2945,[],[],https://twitter.com/BawbDylan/status/1369688338253422592,False,,1,https://pbs.twimg.com/media/EwIcSNGWYAAfyI-.jpg,,,,,,,[],,,,
1369684495222378503,1369684495222378503,2021-03-10 10:20:05 Central Standard Time,2021-03-10,10:20:05,-0500,545441132,ordinarygamers,Mutahar,,GameStop stock is surging again wtf is happening.,en,[],[],[],318,453,17431,[],[],https://twitter.com/OrdinaryGamers/status/1369684495222378503,False,,0,,,,,,,,[],,,,
1369674632886956033,1369674632886956033,2021-03-10 09:40:54 Central Standard Time,2021-03-10,09:40:54,-0500,1295526279194828800,parikpatelcfa,"Dr. Parik Patel, BA, CFA, ACCA Esq. 💸",,"Traders: ""I missed the $GME rally I can't believe that everyone got rich without me""  Gamestop:  https://t.co/yCywHTkRPJ",en,[],[],['https://pbs.twimg.com/media/EwIP0YkWEAcEcnF.jpg'],64,578,5508,[],['gme'],https://twitter.com/ParikPatelCFA/status/1369674632886956033,False,,1,https://pbs.twimg.com/media/EwIP0YkWEAcEcnF.jpg,,,,,,,[],,,,
1369648435624894470,1369648435624894470,2021-03-10 07:56:48 Central Standard Time,2021-03-10,07:56:48,-0500,158049457,dougboneparth,Douglas A. Boneparth,,"Just a matter of time before GameStop does a stock split, gets added to the S&amp;P 500 and converts its balance sheet to bitcoin.",en,[],[],[],161,315,4385,[],[],https://twitter.com/dougboneparth/status/1369648435624894470,False,,0,,,,,,,,[],,,,
1369639280830803968,1369639280830803968,2021-03-10 07:20:25 Central Standard Time,2021-03-10,07:20:25,-0500,1295526279194828800,parikpatelcfa,"Dr. Parik Patel, BA, CFA, ACCA Esq. 💸",,Gamestop is like bitcoin and all the other meme stocks are like alt-coins,en,[],[],[],92,182,3505,[],[],https://twitter.com/ParikPatelCFA/status/1369639280830803968,False,,0,,,,,,,,[],,,,
1369327368758730752,1369327368758730752,2021-03-09 10:41:00 Central Standard Time,2021-03-09,10:41:00,-0500,1289342590299512832,cokedupoptions,John W. Rich (Fake Tech Exec),,"DeepFuckingValue said he likes the stock on national TV, and GameStop went up 400%.   What happens when he loves a stock?",en,[],[],[],106,283,5299,[],[],https://twitter.com/Cokedupoptions/status/1369327368758730752,False,,0,,,,,,,,[],,,,
1369258845487382528,1369258845487382528,2021-03-09 06:08:43 Central Standard Time,2021-03-09,06:08:43,-0500,16421419,justinmcelroy,Justin “Hoops” McElroy,,"If you stopped following GameStop stock after it dropped the first time, you're missing its somehow even wilder second spike. In the past week, basically a ton of the market has shifted a bunch of money out of forward looking, not profitable companies and into re-opening plays:",en,[],[],[],37,236,3781,[],[],https://twitter.com/JustinMcElroy/status/1369258845487382528,False,,0,,,,,,,,[],,,,
1369050828833710086,1369050828833710086,2021-03-08 16:22:07 Central Standard Time,2021-03-08,16:22:07,-0500,1360297187926753284,johnpompliano,John Pompliano,,"If you had invested your $1,200 stimulus check in GameStop on April 15th, you would have $44,288 today.",en,[],[],[],238,561,6197,[],[],https://twitter.com/JohnPompliano/status/1369050828833710086,False,,0,,,,,,,,[],,,,
1369046833046167553,1369046833046167553,2021-03-08 16:06:15 Central Standard Time,2021-03-08,16:06:15,-0500,339061487,apompliano,Pomp 🌪,,UPDATE: Gamestop closed today at $194 per share.  The internet always wins.,en,[],[],[],105,269,4903,[],[],https://twitter.com/APompliano/status/1369046833046167553,False,,0,,,,,,,,[],,,,
1369030467257794560,1369030467257794560,2021-03-08 15:01:13 Central Standard Time,2021-03-08,15:01:13,-0500,18856867,zerohedge,zerohedge,,"GAMESTOP CLOSES UP 41% AT $194.50, HIGHEST SINCE FEB. 1  everything is so broken",en,[],[],[],92,277,2463,[],[],https://twitter.com/zerohedge/status/1369030467257794560,False,,0,,,,,,,,[],,,,
1367743123279867909,1367743123279867909,2021-03-05 01:45:46 Central Standard Time,2021-03-05,01:45:46,-0500,1544590226,thehoustonwade,Rock God,,"People talked about $GME a whole bunch in January, but I don't think you realize just what is happening in the market and how this one stock could result in the greatest transfer of wealth in human history... so, I give you this thread:  Why is GameStop a game changer? 1/",en,[],[],[],254,2392,6931,[],['gme'],https://twitter.com/TheHoustonWade/status/1367743123279867909,False,,0,,,,,,,,[],,,,
1365057115623161856,1365057115623161856,2021-02-25 15:52:32 Central Standard Time,2021-02-25,15:52:32,-0500,1295526279194828800,parikpatelcfa,"Dr. Parik Patel, BA, CFA, ACCA Esq. 💸",,"""I heard he invested in Gamestop at $20""  https://t.co/XKLMHZ3XzR",en,[],[],['https://pbs.twimg.com/media/EvGoNgiWYAkrffU.jpg'],91,231,4543,[],[],https://twitter.com/ParikPatelCFA/status/1365057115623161856,False,,1,https://pbs.twimg.com/media/EvGoNgiWYAkrffU.jpg,,,,,,,[],,,,
1365005198226292740,1365005198226292740,2021-02-25 12:26:14 Central Standard Time,2021-02-25,12:26:14,-0500,588569122,wallstreetbets,WallStreetBets,,BREAKING: GameStop to sell shares of $GME over the counter at their stores in lieu of video games.,en,[],[],[],101,246,2751,[],['gme'],https://twitter.com/wallstreetbets/status/1365005198226292740,False,,0,,,,,,,,[],,,,
1364982449164451847,1364982449164451847,2021-02-25 10:55:50 Central Standard Time,2021-02-25,10:55:50,-0500,1337780902680809474,documentingbtc,Documenting Bitcoin 📄,,GameStop could stop the game if they bought #bitcoin,en,[],[],[],92,330,3887,['bitcoin'],[],https://twitter.com/DocumentingBTC/status/1364982449164451847,False,,0,,,,,,,,[],,,,
1364931260049731588,1364931260049731588,2021-02-25 07:32:26 Central Standard Time,2021-02-25,07:32:26,-0500,158049457,dougboneparth,Douglas A. Boneparth,,It’s the year 2032. GameStop is pumped for the 74th time. Coinbase has become the largest publicly traded company on earth. A CryptoPunk sells for $2.1B and Charlie Munger turns 108.,en,[],[],[],84,183,2331,[],[],https://twitter.com/dougboneparth/status/1364931260049731588,False,,0,,,,,,,,[],,,,
1364725053787668480,1364725053787668480,2021-02-24 17:53:02 Central Standard Time,2021-02-24,17:53:02,-0500,1282418324228337665,wsbmod,wallstreetbets,,DFV's Gamestop price target  https://t.co/8JiDfE5RCZ,sl,[],[],[],131,402,3419,[],[],https://twitter.com/wsbmod/status/1364725053787668480,False,,1,https://pbs.twimg.com/ext_tw_video_thumb/1364724772647563266/pu/img/NCBzMBCuLAAPbPEE.jpg,,,,,,,[],,,,
1364719677675622409,1364719677675622409,2021-02-24 17:31:41 Central Standard Time,2021-02-24,17:31:41,-0500,70739029,jon_bois,Jon Bois,,the reason gamestop stock is going up is that more and more people are playing video games these days,en,[],[],[],62,295,5345,[],[],https://twitter.com/jon_bois/status/1364719677675622409,False,,0,,,,,,,,[],,,,
1364701662724587520,1364701662724587520,2021-02-24 16:20:05 Central Standard Time,2021-02-24,16:20:05,-0500,95023423,uberfacts,UberFacts,,"In 2017, an 11-year-old bought a second-hand copy of ""GTA V"" from a GameStop in Florida and found a bag of meth inside",en,[],[],[],114,418,5896,[],[],https://twitter.com/UberFacts/status/1364701662724587520,False,,0,,,,,,,,[],,,,
1364697070117023747,1364697070117023747,2021-02-24 16:01:51 Central Standard Time,2021-02-24,16:01:51,-0500,1282418324228337665,wsbmod,wallstreetbets,,GAMESTOP 🚀🚀🚀🚀🚀  https://t.co/4783xxa3pd,en,[],[],[],530,3630,16751,[],[],https://twitter.com/wsbmod/status/1364697070117023747,False,,1,https://pbs.twimg.com/ext_tw_video_thumb/1364696942194929665/pu/img/3rYUV5r113zQXs-Z.jpg,,,,,,,[],,,,
1364690801222160392,1364690801222160392,2021-02-24 15:36:56 Central Standard Time,2021-02-24,15:36:56,-0500,1333497225696129025,cryptocuiture,Crypto News🚀,,"GameStop we are back, FUCK THE SUITS   https://t.co/2ag8iioRSS",en,[],[],[],22,402,2880,[],[],https://twitter.com/CryptoCuIture/status/1364690801222160392,False,,1,https://pbs.twimg.com/ext_tw_video_thumb/1355153969807568898/pu/img/rbxrR0v0l1DcNjwf.jpg,,,,,,,[],,,,
1364690492722614272,1364690492722614272,2021-02-24 15:35:42 Central Standard Time,2021-02-24,15:35:42,-0500,6351572,phillyd,Philip “Skinny Legend” DeFranco 👊🏻,,Oh no. The GameStop memes are back. 🙌💎,en,[],[],[],91,115,4544,[],[],https://twitter.com/PhillyD/status/1364690492722614272,False,,0,,,,,,,,[],,,,
1364690486246707200,1364690486246707200,2021-02-24 15:35:41 Central Standard Time,2021-02-24,15:35:41,-0500,1295526279194828800,parikpatelcfa,"Dr. Parik Patel, BA, CFA, ACCA Esq. 💸",,"If you liked Gamestop in January, you'll LOVE it in February",en,[],[],[],65,301,4296,[],[],https://twitter.com/ParikPatelCFA/status/1364690486246707200,False,,0,,,,,,,,[],,,,
1364687042400030726,1364687042400030726,2021-02-24 15:22:00 Central Standard Time,2021-02-24,15:22:00,-0500,1282418324228337665,wsbmod,wallstreetbets,,BREAKING: All of Reddit is down.  Gamestop still up tho 😏  https://t.co/Cxxa29rsmX,en,[],[],['https://pbs.twimg.com/tweet_video_thumb/EvBXoSlUUAIOAfM.jpg'],350,1121,9502,[],[],https://twitter.com/wsbmod/status/1364687042400030726,False,,1,https://pbs.twimg.com/tweet_video_thumb/EvBXoSlUUAIOAfM.jpg,,,,,,,[],,,,
1364684368296476685,1364684368296476685,2021-02-24 15:11:22 Central Standard Time,2021-02-24,15:11:22,-0500,823707032,aphrodiddy,Aphrodite,,since reddit took it down here you go 😌 #gme #gamestop  https://t.co/iL1ElUfN6T,en,[],[],['https://pbs.twimg.com/media/EvBVMRAXcAYPlRN.jpg'],107,770,4003,"['gme', 'gamestop']",[],https://twitter.com/aphrodiddy/status/1364684368296476685,False,,1,https://pbs.twimg.com/media/EvBVMRAXcAYPlRN.jpg,,,,,,,[],,,,
1364683985905942530,1364683985905942530,2021-02-24 15:09:51 Central Standard Time,2021-02-24,15:09:51,-0500,15392486,disclosetv,Disclose.tv 🚨,,"JUST IN -  https://t.co/yyHGdOQe92 down, GameStop ($GME) stock up 103% in late-afternoon trading before shares were halted.",en,[],['http://Reddit.com'],[],113,895,3690,[],[],https://twitter.com/disclosetv/status/1364683985905942530,False,,0,,,,,,,,[],,,,
1364683065700847624,1364683065700847624,2021-02-24 15:06:12 Central Standard Time,2021-02-24,15:06:12,-0500,34713362,business,Bloomberg,,GameStop shares closed up more than 100%  https://t.co/7kLKZpiJeB  https://t.co/absD5ZvpxO,en,[],['https://trib.al/vQOQRZI'],['https://pbs.twimg.com/media/EvBUBBfXEAUdkiG.jpg'],171,746,3561,[],[],https://twitter.com/business/status/1364683065700847624,False,,1,https://pbs.twimg.com/media/EvBUBBfXEAUdkiG.jpg,,,,,,,[],,,,
1364682826084450310,1364682826084450310,2021-02-24 15:05:14 Central Standard Time,2021-02-24,15:05:14,-0500,339061487,apompliano,Pomp 🌪,,Gamestop up 100% today 👀,en,[],[],[],132,248,3928,[],[],https://twitter.com/APompliano/status/1364682826084450310,False,,0,,,,,,,,[],,,,
1364682100897685509,1364682100897685509,2021-02-24 15:02:22 Central Standard Time,2021-02-24,15:02:22,-0500,1148271510660026368,pardonmymeme,PMT memes,,Hedge funds seeing GameStop go to the moon again  https://t.co/CSXA0b11kD,en,[],[],['https://pbs.twimg.com/media/EvBTIyIXYAACsxJ.jpg'],28,1020,7274,[],[],https://twitter.com/PardonMyMeme/status/1364682100897685509,False,,1,https://pbs.twimg.com/media/EvBTIyIXYAACsxJ.jpg,,,,,,,[],,,,
1364681869325983753,1364681869325983753,2021-02-24 15:01:26 Central Standard Time,2021-02-24,15:01:26,-0500,158049457,dougboneparth,Douglas A. Boneparth,,"If you liked it when Robinhood stopped trading GameStop the first time, you’re going to love it when they stop trading it a second time.",en,[],[],[],161,979,8311,[],[],https://twitter.com/dougboneparth/status/1364681869325983753,False,,0,,,,,,,,[],,,,
1364681357125840896,1364681357125840896,2021-02-24 14:59:24 Central Standard Time,2021-02-24,14:59:24,-0500,1282418324228337665,wsbmod,wallstreetbets,,Went to my local gamestop to get some new sega genesis games but ended up buying this instead.  https://t.co/cRXFMX5S6n,en,[],[],['https://pbs.twimg.com/media/EvBSO7ZUcAA85Tc.png'],108,547,6481,[],[],https://twitter.com/wsbmod/status/1364681357125840896,False,,1,https://pbs.twimg.com/media/EvBSO7ZUcAA85Tc.png,,,,,,,[],,,,
1364678789956063232,1364678789956063232,2021-02-24 14:49:12 Central Standard Time,2021-02-24,14:49:12,-0500,19040580,slasher,Rod Breslau,,here we go again gamestop up over 100% in the last hour  https://t.co/Jb0ZU210xF,en,[],[],['https://pbs.twimg.com/media/EvBQDBTWgAEqCu_.png'],163,851,10537,[],[],https://twitter.com/Slasher/status/1364678789956063232,False,,1,https://pbs.twimg.com/media/EvBQDBTWgAEqCu_.png,,,,,,,[],,,,
1364678644459831299,1364678644459831299,2021-02-24 14:48:37 Central Standard Time,2021-02-24,14:48:37,-0500,932630991298007041,litcapital,litquidity,,Mfs will create technical charts like this and then buy two shares of GameStop  https://t.co/5jxebYSASb,en,[],[],['https://pbs.twimg.com/media/EvBP_nrXEAA9ke9.jpg'],40,214,2703,[],[],https://twitter.com/litcapital/status/1364678644459831299,False,,1,https://pbs.twimg.com/media/EvBP_nrXEAA9ke9.jpg,,,,,,,[],,,,
1364654128660635657,1364654128660635657,2021-02-24 13:11:12 Central Standard Time,2021-02-24,13:11:12,-0500,2172596028,danpriceseattle,Dan Price,,"GameStop closed 400+ stores, laid off 14% of corporate staff, told employees to disobey shutdown orders in the early days of the pandemic and had them do TikTok dance videos to compete for holiday hours.  Its CFO just left with a $2.8 million bonus  https://t.co/Go816LI6yS",en,[],['https://kotaku.com/gamestop-exec-leaves-with-2-8-million-severance-1846340815'],[],172,1248,3936,[],[],https://twitter.com/DanPriceSeattle/status/1364654128660635657,False,,0,,,,,,,,[],,,,
1364607165655310336,1364607159762354184,2021-02-24 10:04:36 Central Standard Time,2021-02-24,10:04:36,-0500,2341888057,netflixfr,Netflix France,,- Avatar : Le Dernier Maître de l’Air (la série en live-action) - Cowboy Bebop (la série en live-action) - One Piece (la série en live-action) - Cyberpunk Edgerunners - Les séries et films Narnia - La série d’animation Splinter Cell - Le documentaire sur l’affaire Gamestop,fr,[],[],[],90,384,3423,[],[],https://twitter.com/NetflixFR/status/1364607165655310336,False,,0,,,,,,,,[],,,,
1364433263096336387,1364433263096336387,2021-02-23 22:33:34 Central Standard Time,2021-02-23,22:33:34,-0500,1339634178145492992,corgiloverss,Corgi Lovers,,Family photo ♥️  #dogsoftwitter #GameStop  https://t.co/WPp7DvbVPD,en,[],[],['https://pbs.twimg.com/media/Eu9wlHdUUAUsuEm.jpg'],144,454,5176,"['dogsoftwitter', 'gamestop']",[],https://twitter.com/CorgiLoverss/status/1364433263096336387,False,,1,https://pbs.twimg.com/media/Eu9wlHdUUAUsuEm.jpg,,,,,,,[],,,,
1364324912396140554,1364324912396140554,2021-02-23 15:23:01 Central Standard Time,2021-02-23,15:23:01,-0500,115485051,conanobrien,Conan O'Brien,,"Okay guys, I finally caved and bought stock in GameStop. Wish me luck!",en,[],[],[],1624,2227,39091,[],[],https://twitter.com/ConanOBrien/status/1364324912396140554,False,,0,,,,,,,,[],,,,
1363905382691840004,1363905382691840004,2021-02-22 11:35:58 Central Standard Time,2021-02-22,11:35:58,-0500,1691583385,werlyb,Jorge 'Werlyb',,En la Sexta me sacaron como cobrador de acciones de GameStop y en telecinco salgo cieguísimo perreando al suelo.  Quien no me conozca se va a pensar que soy un Rockstar como Duki.,es,[],[],[],15,269,5891,[],[],https://twitter.com/werlyb/status/1363905382691840004,False,,0,,,,,,,,[],,,,
1363289921146953730,1363156486231379969,2021-02-20 18:50:20 Central Standard Time,2021-02-20,18:50:20,-0500,1234246382803918849,surrealsoulja,hisoka no pico of the snyderverse,,@Thamsanqa_4 We just proved when poor people invest the government goes crazy and they block markets.... GameStop literally just happened 🤦🏾‍♂️,en,[],[],[],11,321,5884,[],[],https://twitter.com/surrealsoulja/status/1363289921146953730,False,,0,,,,,,,,"[{'screen_name': 'Thamsanqa_4', 'name': 'Abstract Gent', 'id': '1085724756'}]",,,,
1362963551279853572,1362963551279853572,2021-02-19 21:13:27 Central Standard Time,2021-02-19,21:13:27,-0500,14216123,jimcramer,Jim Cramer,,"Here's what's wrong with those who attack me for telling people to sell Gamestop at $350 and defend owning it at $50 or $40. There is one goal: to make money. These are stocks, NOT companies.",en,[],[],[],383,234,3724,[],[],https://twitter.com/jimcramer/status/1362963551279853572,False,,0,,,,,,,,[],,,,
1362816787423854596,1362816787423854596,2021-02-19 11:30:16 Central Standard Time,2021-02-19,11:30:16,-0500,1378000488,originalfunko,Funko,,Coming soon: Prepare your Pop! collection for the Pop! Games: Mortal Kombat- Mileena⚔️ (@GameStop exclusive). FINISH HIM - Pre-order yours now!  https://t.co/9T5zpYZkhR #Funko #FunkoPop #MortalKombat  https://t.co/h7cvTZ0EuS,en,"[{'screen_name': 'gamestop', 'name': 'gamestop', 'id': '22258315'}]",['https://bit.ly/2OPFWDz'],['https://pbs.twimg.com/media/EumypP5XYAMfPy0.jpg'],140,530,2728,"['funko', 'funkopop', 'mortalkombat']",[],https://twitter.com/OriginalFunko/status/1362816787423854596,False,,1,https://pbs.twimg.com/media/EumypP5XYAMfPy0.jpg,,,,,,,[],,,,
1362588988431880194,1362588988431880194,2021-02-18 20:25:05 Central Standard Time,2021-02-18,20:25:05,-0500,1222987575369117701,redditinvestors,Reddit Investors,,"In September 2019 Keith Gill posted a screen shot on WSB saying ""Yolo"" with roughly $53,000 in a GameStop long position.  The position was 50,000 shares and 500 call options.  By January 27, 2021, Gill's original investment was $48 million.  https://t.co/UbCipNap5k",en,[],[],['https://pbs.twimg.com/media/Eujja9cWgAAQT5Q.jpg'],86,296,3560,[],[],https://twitter.com/redditinvestors/status/1362588988431880194,False,,1,https://pbs.twimg.com/media/Eujja9cWgAAQT5Q.jpg,,,,,,,[],,,,
1362516966569897985,1362516966569897985,2021-02-18 15:38:53 Central Standard Time,2021-02-18,15:38:53,-0500,14096763,thestalwart,Joe Weisenthal,,It still bothers me that the big scandal was that costumers weren't able to buy GameStop shares at a 1000% overvalued price.,en,[],[],[],122,116,1638,[],[],https://twitter.com/TheStalwart/status/1362516966569897985,False,,0,,,,,,,,[],,,,
1362502782524084224,1362502782524084224,2021-02-18 14:42:32 Central Standard Time,2021-02-18,14:42:32,-0500,16298441,dril,wint,,KitsuneHorace says theres a secret game stop located under the Lincoln Memorial where congressmen are allowed to shop without wearing a Mask,en,[],[],[],35,929,7761,[],[],https://twitter.com/dril/status/1362502782524084224,False,,0,,,,,,,,[],,,,
1362500514756321285,1362500514756321285,2021-02-18 14:33:31 Central Standard Time,2021-02-18,14:33:31,-0500,19631395,videogamedeals,Cheap Ass Gamer,,Follow CAG &amp; Retweet for a Chance to Win Some Zelda: Skyward Sword Joy Cons. Ends Feb. 28th at 9PM ET. USA Only. Available Now via GameStop.  https://t.co/DAfjR6uBs0  https://t.co/QXf7tpFYrd,en,[],['http://ow.ly/9j8Z30rxsdX'],['https://pbs.twimg.com/tweet_video_thumb/EuiS_5EXMAkQt4F.jpg'],198,11420,4759,[],[],https://twitter.com/videogamedeals/status/1362500514756321285,False,,1,https://pbs.twimg.com/tweet_video_thumb/EuiS_5EXMAkQt4F.jpg,,,,,,,[],,,,
1362458489172488196,1362458489172488196,2021-02-18 11:46:31 Central Standard Time,2021-02-18,11:46:31,-0500,19546277,yahoofinance,Yahoo Finance,,"“I am not a cat, I am not an institutional investor, nor am I a hedge fund,” Keith Gill (@TheRoaringKitty) tells the House Committee on Financial Services. “I’m just an individual whose investment in GameStop and posts on social media were based on my own research and analysis.”  https://t.co/FLxSHfUpZW",en,"[{'screen_name': 'theroaringkitty', 'name': 'roaring kitty', 'id': '2902349190'}]",[],[],126,733,3071,[],[],https://twitter.com/YahooFinance/status/1362458489172488196,False,,1,https://pbs.twimg.com/media/EuhsZdJWgAE1Bqe.jpg,,,,,,,[],,,,
1362457626295074823,1362457626295074823,2021-02-18 11:43:06 Central Standard Time,2021-02-18,11:43:06,-0500,398088661,mepfuller,Matt Fuller,,"It’s so damn fitting that the random GameStop investor they brought for this hearing is sitting in a gamer chair, using a streamer mic, and has a little cat poster in the background that says “Hang in there.”  He knows his role here is to be a meme, and he nailed it.  https://t.co/k0Qnu39M4G",en,[],[],['https://pbs.twimg.com/media/Euhr_TjXUAARKkv.jpg'],55,274,2348,[],[],https://twitter.com/MEPFuller/status/1362457626295074823,False,,1,https://pbs.twimg.com/media/Euhr_TjXUAARKkv.jpg,,,,,,,[],,,,
1362452560456675328,1362452560456675328,2021-02-18 11:22:58 Central Standard Time,2021-02-18,11:22:58,-0500,19040580,slasher,Rod Breslau,,"the gamestop hearing with testimony from Robinhood, Reddit CEOs and Roaring Kitty has started. godspeed DFV  https://t.co/rry9OZL47W",en,[],[],['https://pbs.twimg.com/media/Euhm5x9WgAMMkUV.jpg'],85,331,7877,[],[],https://twitter.com/Slasher/status/1362452560456675328,False,,1,https://pbs.twimg.com/media/Euhm5x9WgAMMkUV.jpg,,,,,,,[],,,,
1362392918938554369,1362392918938554369,2021-02-18 07:25:58 Central Standard Time,2021-02-18,07:25:58,-0500,1409511360,jtdaugh,Jesse Daugherty,,This is hilarious.   /u/DeepFuckingValue turned his House testimony into a 5-pager on why GameStop is still undervalued   https://t.co/KXbL8ZNhmO,en,[],['https://docs.house.gov/meetings/BA/BA00/20210218/111207/HHRG-117-BA00-Wstate-GillK-20210218.pdf'],[],57,384,2734,[],[],https://twitter.com/jtdaugh/status/1362392918938554369,False,,0,,,,,,,,[],,,,
