id,conversation_id,created_at,date,time,timezone,user_id,username,name,place,tweet,language,mentions,urls,photos,replies_count,retweets_count,likes_count,hashtags,cashtags,link,retweet,quote_url,video,thumbnail,near,geo,source,user_rt_id,user_rt,retweet_id,reply_to,retweet_date,translate,trans_src,trans_dest
1365005198226292740,1365005198226292740,2021-02-25 12:26:14 Central Standard Time,2021-02-25,12:26:14,-0500,588569122,wallstreetbets,WallStreetBets,,BREAKING: GameStop to sell shares of $GME over the counter at their stores in lieu of video games.,en,[],[],[],101,242,2735,[],['gme'],https://twitter.com/wallstreetbets/status/1365005198226292740,False,,0,,,,,,,,[],,,,
1364982449164451847,1364982449164451847,2021-02-25 10:55:50 Central Standard Time,2021-02-25,10:55:50,-0500,1337780902680809474,documentingbtc,Documenting Bitcoin 📄,,GameStop could stop the game if they bought #bitcoin,en,[],[],[],92,327,3864,['bitcoin'],[],https://twitter.com/DocumentingBTC/status/1364982449164451847,False,,0,,,,,,,,[],,,,
1364931260049731588,1364931260049731588,2021-02-25 07:32:26 Central Standard Time,2021-02-25,07:32:26,-0500,158049457,dougboneparth,Douglas A. Boneparth,,It’s the year 2032. GameStop is pumped for the 74th time. Coinbase has become the largest publicly traded company on earth. A CryptoPunk sells for $2.1B and Charlie Munger turns 108.,en,[],[],[],84,179,2324,[],[],https://twitter.com/dougboneparth/status/1364931260049731588,False,,0,,,,,,,,[],,,,
1364725053787668480,1364725053787668480,2021-02-24 17:53:02 Central Standard Time,2021-02-24,17:53:02,-0500,1282418324228337665,wsbmod,wallstreetbets,,DFV's Gamestop price target  https://t.co/8JiDfE5RCZ,sl,[],[],[],128,401,3410,[],[],https://twitter.com/wsbmod/status/1364725053787668480,False,,1,https://pbs.twimg.com/ext_tw_video_thumb/1364724772647563266/pu/img/NCBzMBCuLAAPbPEE.jpg,,,,,,,[],,,,
1364719677675622409,1364719677675622409,2021-02-24 17:31:41 Central Standard Time,2021-02-24,17:31:41,-0500,70739029,jon_bois,Jon Bois,,the reason gamestop stock is going up is that more and more people are playing video games these days,en,[],[],[],62,294,5329,[],[],https://twitter.com/jon_bois/status/1364719677675622409,False,,0,,,,,,,,[],,,,
1364701662724587520,1364701662724587520,2021-02-24 16:20:05 Central Standard Time,2021-02-24,16:20:05,-0500,95023423,uberfacts,UberFacts,,"In 2017, an 11-year-old bought a second-hand copy of ""GTA V"" from a GameStop in Florida and found a bag of meth inside",en,[],[],[],112,417,5874,[],[],https://twitter.com/UberFacts/status/1364701662724587520,False,,0,,,,,,,,[],,,,
1364697070117023747,1364697070117023747,2021-02-24 16:01:51 Central Standard Time,2021-02-24,16:01:51,-0500,1282418324228337665,wsbmod,wallstreetbets,,GAMESTOP 🚀🚀🚀🚀🚀  https://t.co/4783xxa3pd,en,[],[],[],530,3614,16712,[],[],https://twitter.com/wsbmod/status/1364697070117023747,False,,1,https://pbs.twimg.com/ext_tw_video_thumb/1364696942194929665/pu/img/3rYUV5r113zQXs-Z.jpg,,,,,,,[],,,,
1364690801222160392,1364690801222160392,2021-02-24 15:36:56 Central Standard Time,2021-02-24,15:36:56,-0500,1333497225696129025,cryptocuiture,Crypto News🚀,,"GameStop we are back, FUCK THE SUITS   https://t.co/2ag8iioRSS",en,[],[],[],22,401,2873,[],[],https://twitter.com/CryptoCuIture/status/1364690801222160392,False,,1,https://pbs.twimg.com/ext_tw_video_thumb/1355153969807568898/pu/img/rbxrR0v0l1DcNjwf.jpg,,,,,,,[],,,,
1364690492722614272,1364690492722614272,2021-02-24 15:35:42 Central Standard Time,2021-02-24,15:35:42,-0500,6351572,phillyd,Philip DeFranco 👊🏻,,Oh no. The GameStop memes are back. 🙌💎,en,[],[],[],91,114,4536,[],[],https://twitter.com/PhillyD/status/1364690492722614272,False,,0,,,,,,,,[],,,,
1364690486246707200,1364690486246707200,2021-02-24 15:35:41 Central Standard Time,2021-02-24,15:35:41,-0500,1295526279194828800,parikpatelcfa,"Dr. Parik Patel, BA, CFA, ACCA Esq. 💸",,"If you liked Gamestop in January, you'll LOVE it in February",en,[],[],[],65,298,4287,[],[],https://twitter.com/ParikPatelCFA/status/1364690486246707200,False,,0,,,,,,,,[],,,,
1364687042400030726,1364687042400030726,2021-02-24 15:22:00 Central Standard Time,2021-02-24,15:22:00,-0500,1282418324228337665,wsbmod,wallstreetbets,,BREAKING: All of Reddit is down.  Gamestop still up tho 😏  https://t.co/Cxxa29rsmX,en,[],[],['https://pbs.twimg.com/tweet_video_thumb/EvBXoSlUUAIOAfM.jpg'],353,1112,9476,[],[],https://twitter.com/wsbmod/status/1364687042400030726,False,,1,https://pbs.twimg.com/tweet_video_thumb/EvBXoSlUUAIOAfM.jpg,,,,,,,[],,,,
1364684368296476685,1364684368296476685,2021-02-24 15:11:22 Central Standard Time,2021-02-24,15:11:22,-0500,823707032,aphrodiddy,Aphrodite,,since reddit took it down here you go 😌 #gme #gamestop  https://t.co/iL1ElUfN6T,en,[],[],['https://pbs.twimg.com/media/EvBVMRAXcAYPlRN.jpg'],105,764,3987,"['gme', 'gamestop']",[],https://twitter.com/aphrodiddy/status/1364684368296476685,False,,1,https://pbs.twimg.com/media/EvBVMRAXcAYPlRN.jpg,,,,,,,[],,,,
1364683065700847624,1364683065700847624,2021-02-24 15:06:12 Central Standard Time,2021-02-24,15:06:12,-0500,34713362,business,Bloomberg,,GameStop shares closed up more than 100%  https://t.co/7kLKZpiJeB  https://t.co/absD5ZvpxO,en,[],['https://trib.al/vQOQRZI'],['https://pbs.twimg.com/media/EvBUBBfXEAUdkiG.jpg'],169,740,3543,[],[],https://twitter.com/business/status/1364683065700847624,False,,1,https://pbs.twimg.com/media/EvBUBBfXEAUdkiG.jpg,,,,,,,[],,,,
1364682826084450310,1364682826084450310,2021-02-24 15:05:14 Central Standard Time,2021-02-24,15:05:14,-0500,339061487,apompliano,Pomp 🌪,,Gamestop up 100% today 👀,en,[],[],[],131,243,3911,[],[],https://twitter.com/APompliano/status/1364682826084450310,False,,0,,,,,,,,[],,,,
1364682100897685509,1364682100897685509,2021-02-24 15:02:22 Central Standard Time,2021-02-24,15:02:22,-0500,1148271510660026368,pardonmymeme,PMT memes,,Hedge funds seeing GameStop go to the moon again  https://t.co/CSXA0b11kD,en,[],[],['https://pbs.twimg.com/media/EvBTIyIXYAACsxJ.jpg'],28,1015,7248,[],[],https://twitter.com/PardonMyMeme/status/1364682100897685509,False,,1,https://pbs.twimg.com/media/EvBTIyIXYAACsxJ.jpg,,,,,,,[],,,,
1364681869325983753,1364681869325983753,2021-02-24 15:01:26 Central Standard Time,2021-02-24,15:01:26,-0500,158049457,dougboneparth,Douglas A. Boneparth,,"If you liked it when Robinhood stopped trading GameStop the first time, you’re going to love it when they stop trading it a second time.",en,[],[],[],161,973,8278,[],[],https://twitter.com/dougboneparth/status/1364681869325983753,False,,0,,,,,,,,[],,,,
1364681357125840896,1364681357125840896,2021-02-24 14:59:24 Central Standard Time,2021-02-24,14:59:24,-0500,1282418324228337665,wsbmod,wallstreetbets,,Went to my local gamestop to get some new sega genesis games but ended up buying this instead.  https://t.co/cRXFMX5S6n,en,[],[],['https://pbs.twimg.com/media/EvBSO7ZUcAA85Tc.png'],108,543,6462,[],[],https://twitter.com/wsbmod/status/1364681357125840896,False,,1,https://pbs.twimg.com/media/EvBSO7ZUcAA85Tc.png,,,,,,,[],,,,
1364678789956063232,1364678789956063232,2021-02-24 14:49:12 Central Standard Time,2021-02-24,14:49:12,-0500,19040580,slasher,Rod Breslau,,here we go again gamestop up over 100% in the last hour  https://t.co/Jb0ZU210xF,en,[],[],['https://pbs.twimg.com/media/EvBQDBTWgAEqCu_.png'],160,848,10507,[],[],https://twitter.com/Slasher/status/1364678789956063232,False,,1,https://pbs.twimg.com/media/EvBQDBTWgAEqCu_.png,,,,,,,[],,,,
1364678644459831299,1364678644459831299,2021-02-24 14:48:37 Central Standard Time,2021-02-24,14:48:37,-0500,932630991298007041,litcapital,litquidity,,Mfs will create technical charts like this and then buy two shares of GameStop  https://t.co/5jxebYSASb,en,[],[],['https://pbs.twimg.com/media/EvBP_nrXEAA9ke9.jpg'],40,211,2695,[],[],https://twitter.com/litcapital/status/1364678644459831299,False,,1,https://pbs.twimg.com/media/EvBP_nrXEAA9ke9.jpg,,,,,,,[],,,,
1364654128660635657,1364654128660635657,2021-02-24 13:11:12 Central Standard Time,2021-02-24,13:11:12,-0500,2172596028,danpriceseattle,Dan Price,,"GameStop closed 400+ stores, laid off 14% of corporate staff, told employees to disobey shutdown orders in the early days of the pandemic and had them do TikTok dance videos to compete for holiday hours.  Its CFO just left with a $2.8 million bonus  https://t.co/Go816LI6yS",en,[],['https://kotaku.com/gamestop-exec-leaves-with-2-8-million-severance-1846340815'],[],171,1243,3930,[],[],https://twitter.com/DanPriceSeattle/status/1364654128660635657,False,,0,,,,,,,,[],,,,
1364607165655310336,1364607159762354184,2021-02-24 10:04:36 Central Standard Time,2021-02-24,10:04:36,-0500,2341888057,netflixfr,Netflix France,,- Avatar : Le Dernier Maître de l’Air (la série en live-action) - Cowboy Bebop (la série en live-action) - One Piece (la série en live-action) - Cyberpunk Edgerunners - Les séries et films Narnia - La série d’animation Splinter Cell - Le documentaire sur l’affaire Gamestop,fr,[],[],[],90,384,3413,[],[],https://twitter.com/NetflixFR/status/1364607165655310336,False,,0,,,,,,,,[],,,,
1364433263096336387,1364433263096336387,2021-02-23 22:33:34 Central Standard Time,2021-02-23,22:33:34,-0500,1339634178145492992,corgiloverss,Corgi Lovers,,Family photo ♥️  #dogsoftwitter #GameStop  https://t.co/WPp7DvbVPD,en,[],[],['https://pbs.twimg.com/media/Eu9wlHdUUAUsuEm.jpg'],144,454,5158,"['dogsoftwitter', 'gamestop']",[],https://twitter.com/CorgiLoverss/status/1364433263096336387,False,,1,https://pbs.twimg.com/media/Eu9wlHdUUAUsuEm.jpg,,,,,,,[],,,,
1364324912396140554,1364324912396140554,2021-02-23 15:23:01 Central Standard Time,2021-02-23,15:23:01,-0500,115485051,conanobrien,Conan O'Brien,,"Okay guys, I finally caved and bought stock in GameStop. Wish me luck!",en,[],[],[],1610,2213,39032,[],[],https://twitter.com/ConanOBrien/status/1364324912396140554,False,,0,,,,,,,,[],,,,
1363905382691840004,1363905382691840004,2021-02-22 11:35:58 Central Standard Time,2021-02-22,11:35:58,-0500,1691583385,werlyb,Jorge 'Werlyb',,En la Sexta me sacaron como cobrador de acciones de GameStop y en telecinco salgo cieguísimo perreando al suelo.  Quien no me conozca se va a pensar que soy un Rockstar como Duki.,es,[],[],[],15,269,5888,[],[],https://twitter.com/werlyb/status/1363905382691840004,False,,0,,,,,,,,[],,,,
1363289921146953730,1363156486231379969,2021-02-20 18:50:20 Central Standard Time,2021-02-20,18:50:20,-0500,1234246382803918849,surrealsoulja,hisoka no pico of the snyderverse,,@Thamsanqa_4 We just proved when poor people invest the government goes crazy and they block markets.... GameStop literally just happened 🤦🏾‍♂️,en,[],[],[],11,320,5861,[],[],https://twitter.com/surrealsoulja/status/1363289921146953730,False,,0,,,,,,,,"[{'screen_name': 'Thamsanqa_4', 'name': 'Abstract Gent', 'id': '1085724756'}]",,,,
1362963551279853572,1362963551279853572,2021-02-19 21:13:27 Central Standard Time,2021-02-19,21:13:27,-0500,14216123,jimcramer,Jim Cramer,,"Here's what's wrong with those who attack me for telling people to sell Gamestop at $350 and defend owning it at $50 or $40. There is one goal: to make money. These are stocks, NOT companies.",en,[],[],[],381,233,3714,[],[],https://twitter.com/jimcramer/status/1362963551279853572,False,,0,,,,,,,,[],,,,
1362816787423854596,1362816787423854596,2021-02-19 11:30:16 Central Standard Time,2021-02-19,11:30:16,-0500,1378000488,originalfunko,Funko,,Coming soon: Prepare your Pop! collection for the Pop! Games: Mortal Kombat- Mileena⚔️ (@GameStop exclusive). FINISH HIM - Pre-order yours now!  https://t.co/9T5zpYZkhR #Funko #FunkoPop #MortalKombat  https://t.co/h7cvTZ0EuS,en,"[{'screen_name': 'gamestop', 'name': 'gamestop', 'id': '22258315'}]",['https://bit.ly/2OPFWDz'],['https://pbs.twimg.com/media/EumypP5XYAMfPy0.jpg'],140,526,2721,"['funko', 'funkopop', 'mortalkombat']",[],https://twitter.com/OriginalFunko/status/1362816787423854596,False,,1,https://pbs.twimg.com/media/EumypP5XYAMfPy0.jpg,,,,,,,[],,,,
1362588988431880194,1362588988431880194,2021-02-18 20:25:05 Central Standard Time,2021-02-18,20:25:05,-0500,1222987575369117701,redditinvestors,Reddit Investors,,"In September 2019 Keith Gill posted a screen shot on WSB saying ""Yolo"" with roughly $53,000 in a GameStop long position.  The position was 50,000 shares and 500 call options.  By January 27, 2021, Gill's original investment was $48 million.  https://t.co/UbCipNap5k",en,[],[],['https://pbs.twimg.com/media/Eujja9cWgAAQT5Q.jpg'],85,295,3556,[],[],https://twitter.com/redditinvestors/status/1362588988431880194,False,,1,https://pbs.twimg.com/media/Eujja9cWgAAQT5Q.jpg,,,,,,,[],,,,
1362516966569897985,1362516966569897985,2021-02-18 15:38:53 Central Standard Time,2021-02-18,15:38:53,-0500,14096763,thestalwart,Joe Weisenthal,,It still bothers me that the big scandal was that costumers weren't able to buy GameStop shares at a 1000% overvalued price.,en,[],[],[],122,116,1637,[],[],https://twitter.com/TheStalwart/status/1362516966569897985,False,,0,,,,,,,,[],,,,
1362502782524084224,1362502782524084224,2021-02-18 14:42:32 Central Standard Time,2021-02-18,14:42:32,-0500,16298441,dril,wint,,KitsuneHorace says theres a secret game stop located under the Lincoln Memorial where congressmen are allowed to shop without wearing a Mask,en,[],[],[],35,927,7767,[],[],https://twitter.com/dril/status/1362502782524084224,False,,0,,,,,,,,[],,,,
1362500514756321285,1362500514756321285,2021-02-18 14:33:31 Central Standard Time,2021-02-18,14:33:31,-0500,19631395,videogamedeals,Cheap Ass Gamer,,Follow CAG &amp; Retweet for a Chance to Win Some Zelda: Skyward Sword Joy Cons. Ends Feb. 28th at 9PM ET. USA Only. Available Now via GameStop.  https://t.co/DAfjR6uBs0  https://t.co/QXf7tpFYrd,en,[],['http://ow.ly/9j8Z30rxsdX'],['https://pbs.twimg.com/tweet_video_thumb/EuiS_5EXMAkQt4F.jpg'],198,11298,4747,[],[],https://twitter.com/videogamedeals/status/1362500514756321285,False,,1,https://pbs.twimg.com/tweet_video_thumb/EuiS_5EXMAkQt4F.jpg,,,,,,,[],,,,
1362458489172488196,1362458489172488196,2021-02-18 11:46:31 Central Standard Time,2021-02-18,11:46:31,-0500,19546277,yahoofinance,Yahoo Finance,,"“I am not a cat, I am not an institutional investor, nor am I a hedge fund,” Keith Gill (@TheRoaringKitty) tells the House Committee on Financial Services. “I’m just an individual whose investment in GameStop and posts on social media were based on my own research and analysis.”  https://t.co/FLxSHfUpZW",en,"[{'screen_name': 'theroaringkitty', 'name': 'roaring kitty', 'id': '2902349190'}]",[],[],124,731,3060,[],[],https://twitter.com/YahooFinance/status/1362458489172488196,False,,1,https://pbs.twimg.com/media/EuhsZdJWgAE1Bqe.jpg,,,,,,,[],,,,
1362457626295074823,1362457626295074823,2021-02-18 11:43:06 Central Standard Time,2021-02-18,11:43:06,-0500,398088661,mepfuller,Matt Fuller,,"It’s so damn fitting that the random GameStop investor they brought for this hearing is sitting in a gamer chair, using a streamer mic, and has a little cat poster in the background that says “Hang in there.”  He knows his role here is to be a meme, and he nailed it.  https://t.co/k0Qnu39M4G",en,[],[],['https://pbs.twimg.com/media/Euhr_TjXUAARKkv.jpg'],54,273,2342,[],[],https://twitter.com/MEPFuller/status/1362457626295074823,False,,1,https://pbs.twimg.com/media/Euhr_TjXUAARKkv.jpg,,,,,,,[],,,,
1362452560456675328,1362452560456675328,2021-02-18 11:22:58 Central Standard Time,2021-02-18,11:22:58,-0500,19040580,slasher,Rod Breslau,,"the gamestop hearing with testimony from Robinhood, Reddit CEOs and Roaring Kitty has started. godspeed DFV  https://t.co/rry9OZL47W",en,[],[],['https://pbs.twimg.com/media/Euhm5x9WgAMMkUV.jpg'],85,329,7861,[],[],https://twitter.com/Slasher/status/1362452560456675328,False,,1,https://pbs.twimg.com/media/Euhm5x9WgAMMkUV.jpg,,,,,,,[],,,,
1362392918938554369,1362392918938554369,2021-02-18 07:25:58 Central Standard Time,2021-02-18,07:25:58,-0500,1409511360,jtdaugh,Jesse Daugherty,,This is hilarious.   /u/DeepFuckingValue turned his House testimony into a 5-pager on why GameStop is still undervalued   https://t.co/KXbL8ZNhmO,en,[],['https://docs.house.gov/meetings/BA/BA00/20210218/111207/HHRG-117-BA00-Wstate-GillK-20210218.pdf'],[],57,382,2727,[],[],https://twitter.com/jtdaugh/status/1362392918938554369,False,,0,,,,,,,,[],,,,
1362234637037182977,1362234637037182977,2021-02-17 20:57:01 Central Standard Time,2021-02-17,20:57:01,-0500,1700725878,jennyenicholson,Jenny Nicholson,,Gamestop is taking preorders for a $100 metal pokeball which doesn't open and can't be thrown,en,[],[],[],180,204,6181,[],[],https://twitter.com/JennyENicholson/status/1362234637037182977,False,,0,,,,,,,,[],,,,
1362174262489055235,1362174262489055235,2021-02-17 16:57:06 Central Standard Time,2021-02-17,16:57:06,-0500,718868995336757249,wlwbumbleby,yang enthusiast,,trans/nb people going to pick up splatoon 3 at gamestop 2022  https://t.co/Gk5Fnc6dwP,en,[],[],[],32,1263,3929,[],[],https://twitter.com/wlwbumbleby/status/1362174262489055235,False,,1,https://pbs.twimg.com/ext_tw_video_thumb/1221832556863160324/pu/img/IcgSJU68LPytIa08.jpg,,,,,,,[],,,,
1362102440645046278,1362102440645046278,2021-02-17 12:11:43 Central Standard Time,2021-02-17,12:11:43,-0500,38857814,serebiinet,Serebii.net,,Serebii Note: Gamestop have confirmed the reports of the Shiny Toxtricity event will be held in the US starting February 19th 2021  https://t.co/gDbXkHSvkT  https://t.co/i8JaFByFYf,en,[],['https://www.serebii.net/index2.shtml'],['https://pbs.twimg.com/media/EucotS-XYAIBKD8.jpg'],111,440,2959,[],[],https://twitter.com/SerebiiNet/status/1362102440645046278,False,,1,https://pbs.twimg.com/media/EucotS-XYAIBKD8.jpg,,,,,,,[],,,,
1361944619441864704,1361944619441864704,2021-02-17 01:44:35 Central Standard Time,2021-02-17,01:44:35,-0500,2259809232,super70ssports,Super 70s Sports,,"“Icing happen when the puck come down, bang, you know, before the other guys. Nobody there, you know. My arm go comes up then the game stop then start up.""  https://t.co/y1elwPJJ8V",en,[],[],['https://pbs.twimg.com/media/EuaZaU3WgAAJpMW.jpg'],110,349,2952,[],[],https://twitter.com/Super70sSports/status/1361944619441864704,False,,1,https://pbs.twimg.com/media/EuaZaU3WgAAJpMW.jpg,,,,,,,[],,,,
1361868782126452742,1361868782126452742,2021-02-16 20:43:14 Central Standard Time,2021-02-16,20:43:14,-0500,805532293951606785,mattwallace888,Matt Wallace ⚠️,,"Hey @vladtenev (CEO of @RobinhoodApp)  Remember that time @elonmusk asked you to explain why you put a halt on trading for Gamestop stock, Dogecoin, and a few others?   No more dodging DOGE questions and hiding behind scripted answers...  WE DEMAND TRANSPARENCY!   #RobbingHood",en,"[{'screen_name': 'vladtenev', 'name': 'vlad', 'id': '605700792'}, {'screen_name': 'robinhoodapp', 'name': 'robinhood', 'id': '1265037073'}, {'screen_name': 'elonmusk', 'name': 'elon musk', 'id': '44196397'}]",[],[],327,1673,9962,['robbinghood'],[],https://twitter.com/MattWallace888/status/1361868782126452742,False,,0,,,,,,,,[],,,,
1361619842080460802,1361619842080460802,2021-02-16 04:14:02 Central Standard Time,2021-02-16,04:14:02,-0500,441435243,reggiewebber,reggie,,when i think of jc caylen 1. art teacher that smells like weed 2. the word rustic 3. cool clothes  4. has probably beat up a gamestop employee,en,[],[],[],83,193,5459,[],[],https://twitter.com/reggiewebber/status/1361619842080460802,False,,0,,,,,,,,[],,,,
1361476139714248705,1361476139714248705,2021-02-15 18:43:01 Central Standard Time,2021-02-15,18:43:01,-0500,17975776,franklinbynum,Franklin Bynum 🌹,,"In 2001, the Texas Legislature turned over the electricity grid to Wall Street. They trade megawatts like Gamestop stock while we literally freeze to death. Time to get to work, y’all, we can’t live like this",en,[],[],[],16,495,2229,[],[],https://twitter.com/franklinbynum/status/1361476139714248705,False,,0,,,,,,,,[],,,,
1361314338263478273,1361314338263478273,2021-02-15 08:00:04 Central Standard Time,2021-02-15,08:00:04,-0500,3108351,wsj,The Wall Street Journal,,"A 25-year-old security guard was so enthusiastic about GameStop that he took out a $20,000 personal loan and used it to buy shares. Now his investment is down nearly 80%. Other small-time investors have lost big, too.  https://t.co/hNLdDtSdyD",en,[],['https://on.wsj.com/2Nxq3RO'],[],898,912,2462,[],[],https://twitter.com/WSJ/status/1361314338263478273,False,,0,,,,,,,,[],,,,
1361077770491744259,1361077770491744259,2021-02-14 16:20:02 Central Standard Time,2021-02-14,16:20:02,-0500,105852422,alifarhat79,Jerome Powell,,Parik Patel (dr. PP) after selling GameStop at $480  https://t.co/M5Y3CH3baZ,en,[],[],['https://pbs.twimg.com/media/EuOFBJ6WQAY1p89.jpg'],45,78,2540,[],[],https://twitter.com/alifarhat79/status/1361077770491744259,False,,1,https://pbs.twimg.com/media/EuOFBJ6WQAY1p89.jpg,,,,,,,[],,,,
1360448467160584192,1360275894502383619,2021-02-12 22:39:25 Central Standard Time,2021-02-12,22:39:25,-0500,594175899,mikel_jollett,Mikel Jollett,,@gaetormom Buy. Game. Stop.,en,[],[],[],50,34,3792,[],[],https://twitter.com/Mikel_Jollett/status/1360448467160584192,False,,0,,,,,,,,"[{'screen_name': 'gaetormom', 'name': 'Kelly Boomer', 'id': '548790280'}]",,,,
1360403631288299523,1360403631288299523,2021-02-12 19:41:15 Central Standard Time,2021-02-12,19:41:15,-0500,19040580,slasher,Rod Breslau,,"Robinhood, Reddit, Citadel CEO's have been called in to testify at the GameStop hearing next week and the feds are now investigating for market manipulation. the 12 different movies about this story are going to be fascinating",en,[],[],[],78,475,9299,[],[],https://twitter.com/Slasher/status/1360403631288299523,False,,0,,,,,,,,[],,,,
1360287490788130816,1360287490788130816,2021-02-12 11:59:45 Central Standard Time,2021-02-12,11:59:45,-0500,29856819,therealkiyosaki,therealkiyosaki,,"Why silver.  Love Elon investing billion in Bitcoin. Silver next. Silver still 50% below all time high.  Green New Deal to increase demand. Apple, Tesla &amp; Big pharma need more silver. Why Reddit Raiders failed on silver? GameStop fake asset. Silver real asset. Real FOMO coming",en,[],[],[],470,1361,8272,[],[],https://twitter.com/theRealKiyosaki/status/1360287490788130816,False,,0,,,,,,,,[],,,,
1360022574021791744,1360020499212902401,2021-02-11 18:27:04 Central Standard Time,2021-02-11,18:27:04,-0500,33030256,neil_druckmann,Dr. Uckmann,,@corybarlog FINE! I’ll be in your stupid game. Stop subtweeting me... geez.,en,[],[],[],28,46,3427,[],[],https://twitter.com/Neil_Druckmann/status/1360022574021791744,False,,0,,,,,,,,"[{'screen_name': 'corybarlog', 'name': 'Cory Balrog 🖖', 'id': '161199620'}]",,,,
1359253008798932992,1359253008798932992,2021-02-09 15:29:05 Central Standard Time,2021-02-09,15:29:05,-0500,434545375,causewereguys,Because I'm a Guy,,Hi. welcome to Gamestop  https://t.co/ekdP2Zls9Q,en,[],[],['https://pbs.twimg.com/media/Et0JaAzXYAoMsM_.jpg'],3,151,1411,[],[],https://twitter.com/CauseWereGuys/status/1359253008798932992,False,,1,https://pbs.twimg.com/media/Et0JaAzXYAoMsM_.jpg,,,,,,,[],,,,
1358912348602458116,1358912348602458116,2021-02-08 16:55:25 Central Standard Time,2021-02-08,16:55:25,-0500,1734045566,nikillinit,Nikhil Krishnan,,"we need personal finance strategies that aren't as boring as investing in low cost index funds, not as risky as YOLOing on gamestop, and more attainable than homeownership",en,[],[],[],128,174,1938,[],[],https://twitter.com/nikillinit/status/1358912348602458116,False,,0,,,,,,,,[],,,,
1358641751653777409,1358641751653777409,2021-02-07 23:00:10 Central Standard Time,2021-02-07,23:00:10,-0500,759251,cnn,CNN,,"A 20-year-old college student donated multiple Nintendo Switch consoles and games to Children's Minnesota Hospital in Minneapolis after cashing out almost $30,000 in GameStop stock  https://t.co/dTxhmD7QPP  https://t.co/JsI1RaaYC5",en,[],['https://cnn.it/3jEjbOx'],['https://pbs.twimg.com/media/EtrdeNdWYAEbwHZ.jpg'],91,1037,8390,[],[],https://twitter.com/CNN/status/1358641751653777409,False,,1,https://pbs.twimg.com/media/EtrdeNdWYAEbwHZ.jpg,,,,,,,[],,,,
1358630719929503746,1358630719929503746,2021-02-07 22:16:20 Central Standard Time,2021-02-07,22:16:20,-0500,228456219,giggukaz,Gigguk,,Do you think Gamestop will allow me to trade in my second hand copy of League of Legends,en,[],[],[],127,326,15745,[],[],https://twitter.com/GiggukAZ/status/1358630719929503746,False,,0,,,,,,,,[],,,,
1358601014757257217,1358601014757257217,2021-02-07 20:18:18 Central Standard Time,2021-02-07,20:18:18,-0500,858716964,pftcommenter,PFTCommenter,,GameStop Tom Brady AMC Shaggy. 1994 is very much a live,en,[],[],[],36,293,4926,[],[],https://twitter.com/PFTCommenter/status/1358601014757257217,False,,0,,,,,,,,[],,,,
1358591923431354370,1358591923431354370,2021-02-07 19:42:10 Central Standard Time,2021-02-07,19:42:10,-0500,868578294916145152,wsbchairman,The Chairman,,What my phone sees when Robinhood doesn’t let me buy GameStop😤 #SuperBowl  https://t.co/aVUd1A2P57,en,[],[],['https://pbs.twimg.com/media/EtqwJ3BXEAI7oVK.jpg'],100,524,5062,['superbowl'],[],https://twitter.com/WSBChairman/status/1358591923431354370,False,,1,https://pbs.twimg.com/media/EtqwJ3BXEAI7oVK.jpg,,,,,,,[],,,,
1358304729218961410,1358304729218961410,2021-02-07 00:40:58 Central Standard Time,2021-02-07,00:40:58,-0500,1061349266545885185,itsallrisky,💸💸💸,,#Dogecoin is the movement that GameStop wanted to be #DOGE #dogeto1dollar #dogecoinrise,en,[],[],[],49,733,3017,"['dogecoin', 'doge', 'dogeto1dollar', 'dogecoinrise']",[],https://twitter.com/itsALLrisky/status/1358304729218961410,False,,0,,,,,,,,[],,,,
