id,conversation_id,created_at,date,time,timezone,user_id,username,name,place,tweet,language,mentions,urls,photos,replies_count,retweets_count,likes_count,hashtags,cashtags,link,retweet,quote_url,video,thumbnail,near,geo,source,user_rt_id,user_rt,retweet_id,reply_to,retweet_date,translate,trans_src,trans_dest
1388971937662218247,1388971937662218247,2021-05-02 16:41:30 Central Daylight Time,2021-05-02,16:41:30,-0500,105353526,markminervini,Mark Minervini,,"My good friend called me a month ago, said his 25 year old son wanted to get into stock trading. I sent him my books and told him to start there, but don't trade until I talk with him. Today he texted me his son lost 120k of a 175k investment in $TSLA options. SIgn of the times.",en,[],[],[],482,368,5101,[],['tsla'],https://twitter.com/markminervini/status/1388971937662218247,False,,0,,,,,,,,[],,,,
1388970269415337985,1388970269415337985,2021-05-02 16:34:52 Central Daylight Time,2021-05-02,16:34:52,-0500,1338504695124357122,brsn_tsla,Bright Shining,,뇌는 우리 몸의 2%의 무게를 차지하고 있다. 그런데 뇌가 사용하는 음식에너지는 무려 23%다. 최악의 가성비다. 그래서 우리 뇌는 깊게 생각하는 것을 굉장히 싫어한다. 에너지를 아끼기 위해 귀찮다는 감정으로 몸을 지배하여 내일 음식을 구하지 못해도 생존하기 위한 에너지를 남긴다.👇  https://t.co/o1u7iDMSqQ,ko,[],[],['https://pbs.twimg.com/media/E0adGXLUUAEig1F.png'],1,3140,1857,[],[],https://twitter.com/BRSN_TSLA/status/1388970269415337985,False,,1,https://pbs.twimg.com/media/E0adGXLUUAEig1F.png,,,,,,,[],,,,
1388503179801894915,1388503179801894915,2021-05-01 09:38:49 Central Daylight Time,2021-05-01,09:38:49,-0500,1374059611,teslany,Tesla New York,,"Yonkers Police Department in NY adds @Tesla Model 3 to its fleet 🚔🔋🗽 “We are excited to unveil the city’s first fully electric car,”—@MayorMikeSpano |  https://t.co/U3UApPtUNb $TSLA #Tesla #EV #PD3 @DriveTeslaca @elonmusk @YonkersPD  https://t.co/zpdJ6cPJDx",en,"[{'screen_name': 'tesla', 'name': 'tesla', 'id': '13298072'}, {'screen_name': 'mayormikespano', 'name': 'mayor mike spano', 'id': '147654208'}, {'screen_name': 'driveteslaca', 'name': 'drive tesla 🇨🇦 #fsdbetacanada', 'id': '1169348503975317504'}, {'screen_name': 'elonmusk', 'name': 'elon musk', 'id': '44196397'}, {'screen_name': 'yonkerspd', 'name': 'yonkers police hq', 'id': '140902689'}]",['https://driveteslacanada.ca/model-3/yonkers-police-department-tesla-model-3/'],[],87,293,2174,"['tesla', 'ev', 'pd3']",['tsla'],https://twitter.com/TeslaNY/status/1388503179801894915,False,,1,https://pbs.twimg.com/ext_tw_video_thumb/1388503018367242240/pu/img/LBPkbTOFmRXDjNou.jpg,,,,,,,[],,,,
1388372794149322755,1388372794149322755,2021-05-01 01:00:43 Central Daylight Time,2021-05-01,01:00:43,-0500,1908616248,bevedoni,doniyor,,"What you do when $DOGE hits $1,  $TSLA hits $1000?   I do nothing. I just enjoy the charts.",en,[],[],[],164,206,1900,[],"['doge', 'tsla']",https://twitter.com/bevedoni/status/1388372794149322755,False,,0,,,,,,,,[],,,,
1387865015118614529,1387865015118614529,2021-04-29 15:22:59 Central Daylight Time,2021-04-29,15:22:59,-0500,1413027896,charliebilello,Charlie Bilello,,"Q1 Revenue Growth, YoY % Change... Tesla $TSLA: +73.6% Apple $AAPL: +53.6% Facebook $FB: +47.5% Amazon $AMZN: +43.8% Google $GOOGL: +34.4% Netflix $NFLX: +24.1% Microsoft $MSFT: +19.1% S&amp;P 500 $SPY: +5.6%",en,[],[],[],95,642,2642,[],"['tsla', 'aapl', 'fb', 'amzn', 'googl', 'nflx', 'msft', 'spy']",https://twitter.com/charliebilello/status/1387865015118614529,False,,0,,,,,,,,[],,,,
1387817874551676932,1387817874551676932,2021-04-29 12:15:40 Central Daylight Time,2021-04-29,12:15:40,-0500,804412190493003776,elonsworld,Elon's World,,Tesla will have 5 Gigafactories up and running by the end of 2021 $TSLA,en,[],[],[],94,233,3280,[],['tsla'],https://twitter.com/ElonsWorld/status/1387817874551676932,False,,0,,,,,,,,[],,,,
1387784044457381889,1387784044457381889,2021-04-29 10:01:14 Central Daylight Time,2021-04-29,10:01:14,-0500,930773590227718144,squawksquare,squawksquare,,"Dang. Someone just bought a 550,000 share order of $TSLA.",en,[],[],[],188,113,1750,[],['tsla'],https://twitter.com/squawksquare/status/1387784044457381889,False,,0,,,,,,,,[],,,,
1387765655324270600,1387765655324270600,2021-04-29 08:48:10 Central Daylight Time,2021-04-29,08:48:10,-0500,349249475,gerberkawasaki,Ross Gerber,,Ford puts out crap numbers. Can’t make cars. No chips. Factories closed. Look who is the one who can’t make cars... tesla now seems to be the only one making cars... $F $tsla,en,[],[],[],103,146,1716,[],"['f', 'tsla']",https://twitter.com/GerberKawasaki/status/1387765655324270600,False,,0,,,,,,,,[],,,,
1387535938671325196,1387535938671325196,2021-04-28 17:35:21 Central Daylight Time,2021-04-28,17:35:21,-0500,243013409,sawyermerritt,Sawyer Merritt 📈🚀,,"Guys, $TSLA was basically flat from 2014-2019. Tesla increased over 700% last year &amp; we are still up 334% y/y. We hit $900 less than 90 days ago. If you want to be an investor, then stop worrying about daily price action. The positive long term trajectory of Tesla is clear.  1/3",en,[],[],[],92,180,2239,[],['tsla'],https://twitter.com/SawyerMerritt/status/1387535938671325196,False,,0,,,,,,,,[],,,,
1387481192950288386,1387481192950288386,2021-04-28 13:57:49 Central Daylight Time,2021-04-28,13:57:49,-0500,1374059611,teslany,Tesla New York,,"Who’s the biggest competitor to Tesla?  Sandy Munro: “None, there are no competitors to @Tesla!”   https://t.co/zBl6AChHGj $TSLA #Tesla #EV @elonmusk  https://t.co/adSwGqXUlW",en,"[{'screen_name': 'tesla', 'name': 'tesla', 'id': '13298072'}, {'screen_name': 'elonmusk', 'name': 'elon musk', 'id': '44196397'}]",['https://youtu.be/HtY1gcgy5N4'],[],161,656,6634,"['tesla', 'ev']",['tsla'],https://twitter.com/TeslaNY/status/1387481192950288386,False,,1,https://pbs.twimg.com/ext_tw_video_thumb/1387481160826109952/pu/img/DsDP0CffYfChS4NO.jpg,,,,,,,[],,,,
1387160442481565696,1387160442481565696,2021-04-27 16:43:16 Central Daylight Time,2021-04-27,16:43:16,-0500,898021206967951360,teslapodcast,Tesla Daily,,Imagine thinking that getting your competitors to pay you to steal their market share is bad 😅 $TSLA,en,[],[],[],92,182,2060,[],['tsla'],https://twitter.com/TeslaPodcast/status/1387160442481565696,False,,0,,,,,,,,[],,,,
1387150178180870148,1387150178180870148,2021-04-27 16:02:29 Central Daylight Time,2021-04-27,16:02:29,-0500,1161703589942878208,garyblack00,Gary Black,,"@elonmusk - Can $TSLA please consider hiring a PR person? Tesla’s done fine without one to now, but the stakes are higher now with FSD coming, China and Europe expansion, and competitors taking potshots at Tesla as clear market leader.",en,[],[],[],175,104,2304,[],['tsla'],https://twitter.com/garyblack00/status/1387150178180870148,False,,0,,,,,,,,[],,,,
1387075194368323585,1387075194368323585,2021-04-27 11:04:31 Central Daylight Time,2021-04-27,11:04:31,-0500,349249475,gerberkawasaki,Ross Gerber,,I’ve got tesla earnings day burnout today. Tired. This is more than a company. It’s a movement. $tsla,en,[],[],[],132,100,2227,[],['tsla'],https://twitter.com/GerberKawasaki/status/1387075194368323585,False,,0,,,,,,,,[],,,,
1387070053032542212,1387070053032542212,2021-04-27 10:44:05 Central Daylight Time,2021-04-27,10:44:05,-0500,1161703589942878208,garyblack00,Gary Black,,Huge congrats to Rob Maurer of @TeslaPodcast who did an awesome job today vs JimCramer articulating that $TSLA made 4x in its EV business what it made trading #btc. @elonmusk and @MartinViecha please hire Rob to run TSLA PR if he wants it.  https://t.co/tPsOAL5QjW,en,"[{'screen_name': 'teslapodcast', 'name': 'tesla daily', 'id': '898021206967951360'}, {'screen_name': 'elonmusk', 'name': 'elon musk', 'id': '44196397'}, {'screen_name': 'martinviecha', 'name': 'martin viecha', 'id': '319083083'}]",['https://apple.news/A4OmaQrwcRpapRaAU7et6pw'],[],87,191,1842,['btc'],['tsla'],https://twitter.com/garyblack00/status/1387070053032542212,False,,0,,,,,,,,[],,,,
1387050969179901958,1387050969179901958,2021-04-27 09:28:15 Central Daylight Time,2021-04-27,09:28:15,-0500,1091408824941113350,sophistunpaid,Fermi's Pair of Socks,,(Not mine) These regulatory credits are so bearish. 🥴🤡 #TSLA #TESLA #FreeMoneyIsBad  https://t.co/EqouPKEVtP,en,[],[],"['https://pbs.twimg.com/media/Ez_LY0vVgAc-NBr.jpg', 'https://pbs.twimg.com/media/Ez_LY1HVIAcYOWZ.jpg', 'https://pbs.twimg.com/media/Ez_LY3IVcAoFyWB.jpg']",55,198,1360,"['tsla', 'tesla', 'freemoneyisbad']",[],https://twitter.com/SophistUnpaid/status/1387050969179901958,False,,1,https://pbs.twimg.com/media/Ez_LY0vVgAc-NBr.jpg,,,,,,,[],,,,
1387049097140477954,1387049097140477954,2021-04-27 09:20:49 Central Daylight Time,2021-04-27,09:20:49,-0500,930773590227718144,squawksquare,squawksquare,,I've never seen a company get more penalized for making money than $TSLA.,en,[],[],[],78,92,1707,[],['tsla'],https://twitter.com/squawksquare/status/1387049097140477954,False,,0,,,,,,,,[],,,,
1387045345792725002,1387045345792725002,2021-04-27 09:05:55 Central Daylight Time,2021-04-27,09:05:55,-0500,1295526279194828800,parikpatelcfa,"Dr. Parik Patel, BA, CFA, ACCA Esq. 💸",,Wife: do that thing I like  Me: *invests all of our money in OTM $TSLA call options the day before earnings*  Wife: *leaves me*,en,[],[],[],45,68,1650,[],['tsla'],https://twitter.com/ParikPatelCFA/status/1387045345792725002,False,,0,,,,,,,,[],,,,
1387042808406560777,1387042808406560777,2021-04-27 08:55:50 Central Daylight Time,2021-04-27,08:55:50,-0500,349249475,gerberkawasaki,Ross Gerber,,Tesla starting lower. Why? They made $100 mil on bitcoin. Somehow that takes away from a huge qtr without even delivering one model S or X. No one seems to mention this huge q2 upside potential. $tsla,en,[],[],[],148,94,1726,[],['tsla'],https://twitter.com/GerberKawasaki/status/1387042808406560777,False,,0,,,,,,,,[],,,,
1387037380020826123,1387037380020826123,2021-04-27 08:34:15 Central Daylight Time,2021-04-27,08:34:15,-0500,930773590227718144,squawksquare,squawksquare,,$TSLA now down $22 on record earnings. Gotta laugh sometimes at how Wall Street just hates this stock for unknown reasons.,en,[],[],[],138,82,1477,[],['tsla'],https://twitter.com/squawksquare/status/1387037380020826123,False,,0,,,,,,,,[],,,,
1387015007682977801,1387015007682977801,2021-04-27 07:05:21 Central Daylight Time,2021-04-27,07:05:21,-0500,930773590227718144,squawksquare,squawksquare,,"BREAKING: Oppenheimer raises $TSLA PT to $1,080.",en,[],[],[],30,170,1520,[],['tsla'],https://twitter.com/squawksquare/status/1387015007682977801,False,,0,,,,,,,,[],,,,
1387006036826107907,1387006036826107907,2021-04-27 06:29:43 Central Daylight Time,2021-04-27,06:29:43,-0500,1161703589942878208,garyblack00,Gary Black,,"As usual, @CGrantWSJ is being intellectually dishonest in his click bait WSJ headline that $TSLA makes more money trading #btc than it does selling cars. It’s not only a lie; it’s off by a factor of 4x. Intellectual integrity doesn’t apply when it comes to the @WSJ TSLA coverage.",en,"[{'screen_name': 'cgrantwsj', 'name': 'charley grant', 'id': '3043828834'}, {'screen_name': 'wsj', 'name': 'the wall street journal', 'id': '3108351'}]",[],[],100,300,3108,['btc'],['tsla'],https://twitter.com/garyblack00/status/1387006036826107907,False,,0,,,,,,,,[],,,,
1386854591606710273,1386854591606710273,2021-04-26 20:27:55 Central Daylight Time,2021-04-26,20:27:55,-0500,14216123,jimcramer,Jim Cramer,,"years ago, when i met @elonmusk he shared that vision of the giant solar farm powering the whole country. Maybe one day... #Tesla $TSLA",en,"[{'screen_name': 'elonmusk', 'name': 'elon musk', 'id': '44196397'}]",[],[],246,211,3479,['tesla'],['tsla'],https://twitter.com/jimcramer/status/1386854591606710273,False,,0,,,,,,,,[],,,,
1386838409222705153,1386838409222705153,2021-04-26 19:23:37 Central Daylight Time,2021-04-26,19:23:37,-0500,18856867,zerohedge,zerohedge,,"TSLA made $100MM in 1 month of trading crypto, more than it ever made selling cars in 14 years (ex reg credits). It should shut all money losing ventures and become a full time trading desk",en,[],[],[],338,1946,12667,[],[],https://twitter.com/zerohedge/status/1386838409222705153,False,,0,,,,,,,,[],,,,
1386821093059616768,1386821093059616768,2021-04-26 18:14:49 Central Daylight Time,2021-04-26,18:14:49,-0500,29893444,heydave7,Dave Lee,,"If you missed TSLA's earnings, the highlight was @elonmusk sharing in the call that he thinks Tesla's Model Y will become the top-selling vehicle of any kind in 2022 or 2023.  World's top-selling car currently is Corolla at 1.5m units/year.  😮",en,"[{'screen_name': 'elonmusk', 'name': 'elon musk', 'id': '44196397'}]",[],[],184,378,7734,[],[],https://twitter.com/heydave7/status/1386821093059616768,False,,0,,,,,,,,[],,,,
1386780667271393290,1386780667271393290,2021-04-26 15:34:10 Central Daylight Time,2021-04-26,15:34:10,-0500,18856867,zerohedge,zerohedge,,"So TSLA bought $1.5BN in bitcoin in Q1, sold $272MM, and made $101MM in profits.",en,[],[],[],150,504,3637,[],[],https://twitter.com/zerohedge/status/1386780667271393290,False,,0,,,,,,,,[],,,,
1386062020051570690,1386062020051570690,2021-04-24 15:58:32 Central Daylight Time,2021-04-24,15:58:32,-0500,349249475,gerberkawasaki,Ross Gerber,,This will be the most watched #SNL - Elon doing comedy now. May 8th is the date. $tsla #tesla  https://t.co/zvNaX6yRBX,en,[],['https://variety.com/2021/tv/news/elon-musk-saturday-night-live-host-miley-cyrus-tesla-1234959658/#'],[],148,320,2866,"['snl', 'tesla']",['tsla'],https://twitter.com/GerberKawasaki/status/1386062020051570690,False,,0,,,,,,,,[],,,,
1385234117403496450,1385234117403496450,2021-04-22 09:08:44 Central Daylight Time,2021-04-22,09:08:44,-0500,804412190493003776,elonsworld,Elon's World,,"""Tesla is just a car company"" $TSLA  https://t.co/8wqcIZWt7V",en,[],[],['https://pbs.twimg.com/media/EzlXFmpUcAIyxcY.jpg'],307,2753,25632,[],['tsla'],https://twitter.com/ElonsWorld/status/1385234117403496450,False,,1,https://pbs.twimg.com/media/EzlXFmpUcAIyxcY.jpg,,,,,,,[],,,,
1385191041305911301,1385191041305911301,2021-04-22 06:17:34 Central Daylight Time,2021-04-22,06:17:34,-0500,998140573008695296,28delayslater,🐶Earl of FrunkPuppy🐶,,"Media really ramping up attacks against Tesla, Autopilot, Tesla solar, one pedal driving, the Tesla community, and Elon   Someone is scared. Bullish. $TSLA",en,[],[],[],195,501,7114,[],['tsla'],https://twitter.com/28delayslater/status/1385191041305911301,False,,0,,,,,,,,[],,,,
1385070814131720193,1385070814131720193,2021-04-21 22:19:50 Central Daylight Time,2021-04-21,22:19:50,-0500,349249475,gerberkawasaki,Ross Gerber,,At this point it seems crazy to pay $4.30 a gallon for gas. $100 a tank just to pollute the earth when sitting in traffic. The Tesla value proposition has never been greater. Say no to gas stations and car dealers. $tsla,en,[],[],[],287,416,4004,[],['tsla'],https://twitter.com/GerberKawasaki/status/1385070814131720193,False,,0,,,,,,,,[],,,,
1384532645980291073,1384532645980291073,2021-04-20 10:41:20 Central Daylight Time,2021-04-20,10:41:20,-0500,1957568797,johnnacrider1,Johnna Crider,,Tesla fam I need some help. Louisiana is trying to get rid of our ONLY Tesla service and we just got it in 2019/2020.   Help me contact our gov. $tsla @elonmusk    https://t.co/wb4jsQqPmC,en,"[{'screen_name': 'elonmusk', 'name': 'elon musk', 'id': '44196397'}]",['https://engage.tesla.com/articles/190-keep-tesla-s-service-center-louisiana?utm_source=Iterable&utm_medium=email&utm_campaign=service_center&utm_content=ownership&utm_locale='],[],103,455,5819,[],['tsla'],https://twitter.com/JohnnaCrider1/status/1384532645980291073,False,,0,,,,,,,,[],,,,
1384301705857101829,1384301705857101829,2021-04-19 19:23:40 Central Daylight Time,2021-04-19,19:23:40,-0500,258602317,kimpaquette,Kim Paquette 💫🦄,,"Don’t believe Elon? Don’t worry - the NHTSA investigates every #Tesla crash, so the naysayers will have their answers in due time. 🙄 $TSLA $TSLAQ",en,[],[],[],78,207,4040,['tesla'],"['tsla', 'tslaq']",https://twitter.com/kimpaquette/status/1384301705857101829,False,https://twitter.com/elonmusk/status/1384254194975010826,0,,,,,,,,[],,,,
1384259825635237890,1384259825635237890,2021-04-19 16:37:15 Central Daylight Time,2021-04-19,16:37:15,-0500,988955288,investingcom,Investing.com,,*TESLA CEO ELON MUSK SAYS FULL SELF-DRIVING FEATURE NOT BOUGHT FOR CRASHED CAR AND LOGS SHOW AUTOPILOT NOT ENABLED IN CRASH  $TSLA,en,[],[],[],91,444,3597,[],['tsla'],https://twitter.com/Investingcom/status/1384259825635237890,False,,0,,,,,,,,[],,,,
1383884445816561669,1383884445816561669,2021-04-18 15:45:37 Central Daylight Time,2021-04-18,15:45:37,-0500,1289823541098143744,stocktalkweekly,Stock Talk Weekly,,A $DOGE in a $TSLA... it’s all coming together @elonmusk  https://t.co/UL6fgR3P3Q,en,"[{'screen_name': 'elonmusk', 'name': 'elon musk', 'id': '44196397'}]",[],['https://pbs.twimg.com/media/EzSLkOeUcAcmYru.jpg'],55,508,3737,[],"['doge', 'tsla']",https://twitter.com/stocktalkweekly/status/1383884445816561669,False,,1,https://pbs.twimg.com/media/EzSLkOeUcAcmYru.jpg,,,,,,,[],,,,
1382940972133273601,1382940972133273601,2021-04-16 01:16:36 Central Daylight Time,2021-04-16,01:16:36,-0500,1374059611,teslany,Tesla New York,,Cybertruck at Gigafactory Texas! ⚡️😎⚡️ $TSLA #Tesla #Cybertruck #EV @elonmusk  https://t.co/g90Ml0NWTF,en,"[{'screen_name': 'elonmusk', 'name': 'elon musk', 'id': '44196397'}]",[],[],91,397,3275,"['tesla', 'cybertruck', 'ev']",['tsla'],https://twitter.com/TeslaNY/status/1382940972133273601,False,,1,https://pbs.twimg.com/ext_tw_video_thumb/1382940952134844419/pu/img/1hu4QbEgGn2LXP7N.jpg,,,,,,,[],,,,
1382904275018338304,1382904275018338304,2021-04-15 22:50:46 Central Daylight Time,2021-04-15,22:50:46,-0500,1908616248,bevedoni,doniyor,,$DOGE to $10 $TSLA to $2000 $BTC to 100k   short term goals.  anyone? 🙋🏻‍♂️,en,[],[],[],660,1370,10874,[],"['doge', 'tsla', 'btc']",https://twitter.com/bevedoni/status/1382904275018338304,False,,0,,,,,,,,[],,,,
1382890354593169409,1382890354593169409,2021-04-15 21:55:28 Central Daylight Time,2021-04-15,21:55:28,-0500,1303359369736749057,milmilebattery,2X Mil Mile Battery ~ Ryan,,Alright let’s just talk about this real quick @elonmusk 🔥🔥🔥🔥🔥  $TSLA  https://t.co/dXW3MtE7g6,en,"[{'screen_name': 'elonmusk', 'name': 'elon musk', 'id': '44196397'}]",[],"['https://pbs.twimg.com/media/EzEDcovW8AMajTd.jpg', 'https://pbs.twimg.com/media/EzEDcowWEAIlEqT.jpg', 'https://pbs.twimg.com/media/EzEDcoxXAAItWrc.jpg', 'https://pbs.twimg.com/media/EzEDcovW8AIBxhe.jpg']",125,389,3659,[],['tsla'],https://twitter.com/MilMileBattery/status/1382890354593169409,False,,1,https://pbs.twimg.com/media/EzEDcovW8AMajTd.jpg,,,,,,,[],,,,
1381991153067696132,1381991153067696132,2021-04-13 10:22:21 Central Daylight Time,2021-04-13,10:22:21,-0500,349249475,gerberkawasaki,Ross Gerber,,"Tesla shareholders feeling good about the 48,000 bitcoin on the balance sheet. @elonmusk is close to doubling our money on this investment. Love it. Tesla up almost 2 Gordons now. $tsla",en,"[{'screen_name': 'elonmusk', 'name': 'elon musk', 'id': '44196397'}]",[],[],96,201,3115,[],['tsla'],https://twitter.com/GerberKawasaki/status/1381991153067696132,False,,0,,,,,,,,[],,,,
1381627558630948875,1381627558630948875,2021-04-12 10:17:34 Central Daylight Time,2021-04-12,10:17:34,-0500,877807935493033984,binance,Binance,,#Binance just listed the @Tesla $TSLA stock token.  Which stock token should we list next? ⬇️,en,"[{'screen_name': 'tesla', 'name': 'tesla', 'id': '13298072'}]",[],[],2675,1554,9313,['binance'],['tsla'],https://twitter.com/binance/status/1381627558630948875,False,,0,,,,,,,,[],,,,
1381581599947464704,1381581599947464704,2021-04-12 07:14:56 Central Daylight Time,2021-04-12,07:14:56,-0500,902926941413453824,cz_binance,CZ 🔶 Binance,,"Trade stock tokens like $TSLA on @Binance, with zero-commission.",en,"[{'screen_name': 'binance', 'name': 'binance', 'id': '877807935493033984'}]",[],[],21,692,3998,[],['tsla'],https://twitter.com/cz_binance/status/1381581599947464704,False,https://twitter.com/binance/status/1381570383896252416,0,,,,,,,,[],,,,
1381578666824642561,1381578666824642561,2021-04-12 07:03:17 Central Daylight Time,2021-04-12,07:03:17,-0500,14456494,tkolset,Torstein,,"I really don't understand why @elonmusk   🚀Launches people to space 🛰Creates global internet service 🚇Boring tunnels 🔋Builds battery to offset grid 🐒Makes brain interface 🚗Revolutionizing the car industry  And still, people are betting against this guy?😂  $TSLAQ $TSLA",en,"[{'screen_name': 'elonmusk', 'name': 'elon musk', 'id': '44196397'}]",[],[],203,461,3930,[],"['tslaq', 'tsla']",https://twitter.com/tkolset/status/1381578666824642561,False,,0,,,,,,,,[],,,,
1381570383896252416,1381570383896252416,2021-04-12 06:30:22 Central Daylight Time,2021-04-12,06:30:22,-0500,877807935493033984,binance,Binance,,Introducing tradable stock tokens on #Binance!   Trade digital tokens that represent fully backed shares of equity stock.  First stock token listing: @Tesla Inc. $TSLA,en,"[{'screen_name': 'tesla', 'name': 'tesla', 'id': '13298072'}]",[],[],1557,5093,19760,['binance'],['tsla'],https://twitter.com/binance/status/1381570383896252416,False,,0,,,,,,,,[],,,,
1381280556290244609,1381280556290244609,2021-04-11 11:18:42 Central Daylight Time,2021-04-11,11:18:42,-0500,3291691,chamath,Chamath Palihapitiya,,"Early in $FB (2007) Early in @warriors (2011) Early in #Bitcoin (2012) Early in $AMZN (2014) Early in $TSLA (2015) Early in #SPACs (2017)  What’s the pattern?  Prioritize non obvious, well reasoned decisions that, if right, will refute conventional wisdom.",en,"[{'screen_name': 'warriors', 'name': 'golden state warriors', 'id': '26270913'}]",[],[],1631,1995,19446,"['bitcoin', 'spacs']","['fb', 'amzn', 'tsla']",https://twitter.com/chamath/status/1381280556290244609,False,,0,,,,,,,,[],,,,
1379027031527153665,1379027031527153665,2021-04-05 06:04:00 Central Daylight Time,2021-04-05,06:04:00,-0500,1308211178,teslarati,TESLARATI,,Tesla $TSLA receives ‘Outperform’ rating after ‘dropping the mic’ with Q1 numbers  https://t.co/LPA3xewT5H by @ResidentSponge,en,"[{'screen_name': 'residentsponge', 'name': 'simon alvarez', 'id': '798749450223030272'}]",['https://www.teslarati.com/tesla-tsla-mic-drop-moment-wall-st/'],[],59,343,5088,[],['tsla'],https://twitter.com/Teslarati/status/1379027031527153665,False,,0,,,,,,,,[],,,,
1378129300499525633,1378129300499525633,2021-04-02 18:36:44 Central Daylight Time,2021-04-02,18:36:44,-0500,1689516060,vincent13031925,Vincent 🚀🟠,,"Exponential growth of $TSLA Q1 delivery numbers from 2013 to 2021. @elonmusk   2021: 184,800 2020:  88,400 2019:   63,000 2018:   29,980 2017:   25,000 2016:   14,820 2015:   10,045 2014:    6,457 2013:    4,900",en,"[{'screen_name': 'elonmusk', 'name': 'elon musk', 'id': '44196397'}]",[],[],228,867,11611,[],['tsla'],https://twitter.com/vincent13031925/status/1378129300499525633,False,,0,,,,,,,,[],,,,
1378058599235084289,1378058599235084289,2021-04-02 13:55:47 Central Daylight Time,2021-04-02,13:55:47,-0500,348844712,gfilche,Gali,,"savage line outside Santa Monica supercharger, Tesla’s Q1 results IRL $TSLA @elonmusk #nodemand  https://t.co/ahc7uSh272",en,"[{'screen_name': 'elonmusk', 'name': 'elon musk', 'id': '44196397'}]",[],['https://pbs.twimg.com/media/Ex_Y_XwVIAAiOeA.jpg'],144,241,7965,['nodemand'],['tsla'],https://twitter.com/Gfilche/status/1378058599235084289,False,,1,https://pbs.twimg.com/media/Ex_Y_XwVIAAiOeA.jpg,,,,,,,[],,,,
1378056513303015425,1378056513303015425,2021-04-02 13:47:30 Central Daylight Time,2021-04-02,13:47:30,-0500,1651403384,chrisdungeon,Christopher Dungeon,,"""I'm not an investor. I like to make technologies real that I think are important for the future and useful in some sort of way."" @elonmusk   Keyword ""real""  $TSLA FSD will blow minds 🤯  https://t.co/IA7GD3WXbm",en,"[{'screen_name': 'elonmusk', 'name': 'elon musk', 'id': '44196397'}]",[],['https://pbs.twimg.com/media/Ex_XGALWEAQN0t4.jpg'],234,1380,17490,[],['tsla'],https://twitter.com/ChrisDungeon/status/1378056513303015425,False,,1,https://pbs.twimg.com/media/Ex_XGALWEAQN0t4.jpg,,,,,,,[],,,,
1377988303899660290,1377988303899660290,2021-04-02 09:16:28 Central Daylight Time,2021-04-02,09:16:28,-0500,349249475,gerberkawasaki,Ross Gerber,,3 years ago @elonmusk was losing his mind working non stop trying to get Fremont to 5k model 3 EV cars a week. Seemed almost impossible at the time. Today they make 2k a day! $tsla #tesla,en,"[{'screen_name': 'elonmusk', 'name': 'elon musk', 'id': '44196397'}]",[],[],230,899,24999,['tesla'],['tsla'],https://twitter.com/GerberKawasaki/status/1377988303899660290,False,,0,,,,,,,,[],,,,
1377985097626918914,1377985097626918914,2021-04-02 09:03:43 Central Daylight Time,2021-04-02,09:03:43,-0500,349249475,gerberkawasaki,Ross Gerber,,Haha. Tesla blows out production and delivery numbers. Looking at 180k produced and 184k delivered. Massively beating all our conservative estimates. $tsla,en,[],[],[],81,180,3029,[],['tsla'],https://twitter.com/GerberKawasaki/status/1377985097626918914,False,,0,,,,,,,,[],,,,
1377965584021852166,1377965584021852166,2021-04-02 07:46:11 Central Daylight Time,2021-04-02,07:46:11,-0500,898021206967951360,teslapodcast,Tesla Daily,,"Tesla crushes delivery expectations by delivering 184,800 vehicles in Q1, ahead of consensus of 172,230, while producing 180,338. $TSLA  https://t.co/WRNnv6rkDl",en,[],[],['https://pbs.twimg.com/media/Ex-EW-WXAAAoznz.jpg'],159,578,4459,[],['tsla'],https://twitter.com/TeslaPodcast/status/1377965584021852166,False,,1,https://pbs.twimg.com/media/Ex-EW-WXAAAoznz.jpg,,,,,,,[],,,,
